{
  "$schema": "../../../schemas/aether-kinetic-interface-control.schema.json",
  "schemaVersion": "1.0.0",
  "fixtureId": "vx4800-bf-01",
  "interfaceRevision": "1.0.0",
  "status": "engineering-interface-input-not-released",
  "authority": "engineering-development-input",
  "finalInterfaceControlReleased": false,
  "controlledBaseline": {
    "elementCount": 240,
    "sizeAllocation": {"S": 66, "M": 144, "L": 30},
    "canopyEnvelopeMm": [2400, 1500, 150],
    "rotatingCarrierCoordinationMm": {"width": 2260, "depth": 1330, "thicknessParameter": 24},
    "speedRpm": {"minimum": 0.08, "nominal": 0.36, "maximum": 0.65},
    "fixedAccentHeadCount": 14,
    "slipRingStatus": "not-required-by-current-architecture"
  },
  "datumFramework": [
    {
      "id": "KD-A-FIXED-STRUCTURE",
      "role": "Primary fixed structural and machining reference plane for the kinetic mechanism.",
      "status": "tbd-to-drawing",
      "rule": "Datum A must resolve to qualified fixed structure and must not reference decorative canopy skin, false ceiling, removable trim or service panels."
    },
    {
      "id": "KD-B-ROTATION-AXIS",
      "role": "Functional vertical rotation axis shared by the bearing, carrier, direct-carrier brake and feedback coordination model.",
      "status": "functional-reference",
      "rule": "Datum B is a functional axis only until the bearing and structural support geometry are selected and controlled; no fabricated bore or bolt circle may be inferred from it."
    },
    {
      "id": "KD-C-INDEX-AZIMUTH",
      "role": "Angular service and reference-index datum tied to the controlled product orientation.",
      "status": "tbd-to-drawing",
      "rule": "Datum C must be physically recoverable after power restoration and must not imply that arriving at the index means the mechanical service lock is engaged."
    },
    {
      "id": "KD-D-CARRIER-INTERFACE-PLANE",
      "role": "Functional rotating carrier interface plane used to coordinate axial stack and service envelopes.",
      "status": "tbd-to-drawing",
      "rule": "The existing 24 mm carrier thickness parameter is not Datum D and must not be used as the available mechanism stack height."
    }
  ],
  "mechanicalInterfaces": [
    {
      "id": "KI-BEARING",
      "function": "Primary gravity, radial and overturning-load transfer while permitting continuous vertical-axis rotation.",
      "fixedSide": ["qualified structural bearing support", "supplier-compliant mounting face", "accessible controlled fasteners"],
      "rotatingSide": ["selected bearing rotating ring", "structural hub/carrier attachment"],
      "reactionPath": "rotating carrier -> bearing -> fixed structural support -> site structure",
      "prohibitedCommonCause": ["motor/reducer as vertical support", "decorative canopy skin as bearing support", "secondary-retention attachment relying only on the same local failed bearing bolts"],
      "serviceRequirement": "Bearing fasteners, lubrication points where applicable, mounting face/runout references and removal path must remain inspectable and serviceable.",
      "releaseDependencies": ["controlled rotating mass and CG", "combined load cases", "selected bearing exact mating data", "support stiffness/flatness calculation", "controlled fastener preload method"]
    },
    {
      "id": "KI-DRIVE",
      "function": "Apply commanded propulsion torque through a positive transmission without becoming the primary support or access restraint.",
      "fixedSide": ["motor/reducer", "drive sprocket or pinion", "adjustment/tensioning bracket", "guard"],
      "rotatingSide": ["dedicated synchronous toothed ring or ring gear under qualification"],
      "reactionPath": "drive tangential force and pretension reactions -> fixed drive bracket and carrier drive ring -> qualified structural supports",
      "prohibitedCommonCause": ["gearbox self-locking used as service lock", "drive transmission used as sole fault holding path", "unaccounted belt pretension transferred into bearing/support design"],
      "serviceRequirement": "Tension/alignment adjustment, guard removal, drive-module extraction and inspection must be possible without disturbing controlled cable exits.",
      "releaseDependencies": ["approved drive torque envelope", "selected transmission", "pretension/separation forces", "support reaction calculation", "service/removal study"]
    },
    {
      "id": "KI-BRAKE",
      "function": "Provide power-off holding and qualified fault-stop action directly at the carrier independently of a failed drive transmission where required by risk assessment.",
      "fixedSide": ["spring-applied electrically released caliper or equivalent", "fixed structural brake reaction bracket", "manual-release access"],
      "rotatingSide": ["passive carrier brake ring/disc"],
      "reactionPath": "carrier brake ring -> fixed brake caliper/bracket -> fixed structural support",
      "prohibitedCommonCause": ["fault holding torque forced only through belt/gear transmission", "brake treated as the mechanical service lock", "rotating electrical release power"],
      "serviceRequirement": "Friction surfaces, wear/air-gap state, brake-state sensing where selected and guarded manual release must be inspectable without uncontrolled carrier motion.",
      "releaseDependencies": ["holding torque case", "dynamic stopping energy case", "selected brake exact disc/runout requirements", "thermal duty", "Issue #11 electrical release/control interface"]
    },
    {
      "id": "KI-SERVICE-LOCK",
      "function": "Provide positive mechanical restraint for technician access after zero speed verification and isolation.",
      "fixedSide": ["positive captive lock device", "fixed double-shear or equivalently justified bracket", "direct visual verification feature"],
      "rotatingSide": ["dedicated receiver ring/lugs structurally isolated from precision feedback and brake friction surfaces"],
      "reactionPath": "carrier service load -> receiver -> positive lock -> fixed structural bracket -> site structure",
      "prohibitedCommonCause": ["motor torque used as access restraint", "brake status substituted for lock engagement", "lock reaction through precision bearing rolling elements where avoidable", "software index flag treated as physical engagement"],
      "serviceRequirement": "Engagement must be captive, visually obvious, LOTO-compatible and directly verifiable before access; partial engagement must be geometrically detectable or prevented.",
      "releaseDependencies": ["approved service load case", "receiver indexing strategy", "runout/tolerance stack", "proof-load method", "mis-engagement validation"]
    },
    {
      "id": "KI-SECONDARY-RETENTION",
      "function": "Arrest abnormal carrier separation or tilt after relevant primary-support failure without routine running contact.",
      "fixedSide": ["multiple fixed structural catch sectors", "independent attachment regions", "inspection access"],
      "rotatingSide": ["multiple distributed passive capture features on qualified carrier structure"],
      "reactionPath": "abnormally displaced carrier -> distributed capture features -> fixed catch sectors -> fixed structural support",
      "prohibitedCommonCause": ["all capture attachments lost with one relevant bearing-ring failure", "all capture attachments sharing only the same failed bearing bolts", "decorative skin used as catch structure", "routine retention rubbing used as normal support"],
      "serviceRequirement": "Normal clearance and contact witness must be inspectable; any engagement removes the fixture from service pending engineering inspection.",
      "releaseDependencies": ["failure coverage/FMEA", "abnormal load case", "normal clearance tolerance stack", "engagement travel", "fixed-frame reaction calculation", "controlled simulated engagement/proof method"]
    },
    {
      "id": "KI-FEEDBACK-PRIMARY",
      "function": "Measure carrier position, speed and reference/index state using fixed powered electronics and passive rotating features.",
      "fixedSide": ["primary readhead", "adjustable protected bracket", "fixed cable/service connection"],
      "rotatingSide": ["passive scale/target ring", "passive reference/index feature"],
      "reactionPath": "measurement only; no structural, brake or restraint reaction path permitted",
      "prohibitedCommonCause": ["sensor bracket used as carrier restraint", "powered rotating encoder introduced without architecture change", "index signal used as proof of service-lock engagement"],
      "serviceRequirement": "Readhead air gap, alignment, contamination state and replacement adjustment must be inspectable from fixed-side service access.",
      "releaseDependencies": ["selected sensor family", "required resolution/update behavior at 0.08 rpm", "runout/air-gap stack", "reference strategy"]
    },
    {
      "id": "KI-FEEDBACK-DIVERSE",
      "function": "Provide independent or sufficiently diverse speed/overspeed plausibility if allocated by the released risk assessment.",
      "fixedSide": ["independent/diverse fixed sensor channel if required"],
      "rotatingSide": ["passive target set sufficiently independent from the primary feedback failure mode if required"],
      "reactionPath": "measurement only; no mechanical load path",
      "prohibitedCommonCause": ["blindly duplicating the same single failure mechanism", "sharing one software value while claiming independent measurement", "powered rotating target electronics"],
      "serviceRequirement": "Channel identity and diagnostic disagreement must be testable without dismantling the carrier.",
      "releaseDependencies": ["released risk assessment safety-function allocation", "fault-detection latency requirement", "selected sensing technology", "common-cause review"]
    },
    {
      "id": "KI-BALANCE-TRIM",